Title,URL,Source,Type,DateTime,Article,Location,Keywords1,Keywords2
Откриха телата на две жени в Кюстендил,https://nova.bg/news/view/2025/01/28/485275/%D0%BE%D1%82%D0%BA%D1%80%D0%B8%D1%85%D0%B0-%D1%82%D0%B5%D0%BB%D0%B0%D1%82%D0%B0-%D0%BD%D0%B0-%D0%B4%D0%B2%D0%B5-%D0%B6%D0%B5%D0%BD%D0%B8-%D0%B2-%D0%BA%D1%8E%D1%81%D1%82%D0%B5%D0%BD%D0%B4%D0%B8%D0%BB/,nova.bg,TV news,2025-01-28 10:09:00,"Полицията в Кюстендил изяснява причините за смъртта на две жени в града, съобщиха от пресцентъра на ОД на МВР – Кюстендил. 77-годишна жена е открита починала на козирката на жилищен блок в квартал ""Бузлуджа“. 88-годишна жена пък е намерена мъртва в жилището си в квартал ""Осогово“ в града. Откриха телата на двама мъже в Кюстендилско Дежурна полицейска група е извършила оглед на местопроизшествията. Следи от насилие не са установени. Телата са закарани за аутопсия в кюстендилската болница. Образувани са досъдебни производства. За случаите е уведомена и прокуратурата.",Кюстендил, жени,"насил, смърт"
„Идвам да те убия“: Задържаха мъж за нападение с тесла над жена в София,https://nova.bg/news/view/2025/01/27/485166/%D0%B8%D0%B4%D0%B2%D0%B0%D0%BC-%D0%B4%D0%B0-%D1%82%D0%B5-%D1%83%D0%B1%D0%B8%D1%8F-%D0%B7%D0%B0%D0%B4%D1%8A%D1%80%D0%B6%D0%B0%D1%85%D0%B0-%D0%BC%D1%8A%D0%B6-%D0%B7%D0%B0-%D0%BD%D0%B0%D0%BF%D0%B0%D0%B4%D0%B5%D0%BD%D0%B8%D0%B5-%D1%81-%D1%82%D0%B5%D1%81%D0%BB%D0%B0-%D0%BD%D0%B0%D0%B4-%D0%B6%D0%B5%D0%BD%D0%B0-%D0%B2-%D1%81%D0%BE%D1%84%D0%B8%D1%8F/,nova.bg,TV news,2025-01-27 12:59:00,"Софийската районна прокуратура повдигна обвинение срещу 29-годишен мъж, заплашил с убийство и нападнал жена в дома ѝ в столичния квартал ""Ботунец"". Мъжът е задържан за 72 часа. Обвиниха мъж, заканил се с убийство на жена, докато я удрял с юмруци На 24 януари около 18:20 ч. обвиняемият се заканил на потърпевшата, като ѝ казал: „Идвам да те убия“, след което замахнал към нея с тесла, а впоследствие - и с парче дърво. Жената е подала сигнал в полицията. Днес наблюдаващият прокурор е внесъл искане в Софийския районен съд за определяне на мярка за неотклонение „задържане под стража“ спрямо мъжа.",, жена,уби
"„Хамас” освобождава момиче с българско гражданство, държано като заложник",https://nova.bg/news/view/2025/01/24/484943/%D1%85%D0%B0%D0%BC%D0%B0%D1%81-%D0%BE%D1%81%D0%B2%D0%BE%D0%B1%D0%BE%D0%B6%D0%B4%D0%B0%D0%B2%D0%B0-%D0%BC%D0%BE%D0%BC%D0%B8%D1%87%D0%B5-%D1%81-%D0%B1%D1%8A%D0%BB%D0%B3%D0%B0%D1%80%D1%81%D0%BA%D0%BE-%D0%B3%D1%80%D0%B0%D0%B6%D0%B4%D0%B0%D0%BD%D1%81%D1%82%D0%B2%D0%BE-%D0%B4%D1%8A%D1%80%D0%B6%D0%B0%D0%BD%D0%BE-%D0%BA%D0%B0%D1%82%D0%BE-%D0%B7%D0%B0%D0%BB%D0%BE%D0%B6%D0%BD%D0%B8%D0%BA/,nova.bg,TV news,2025-01-24 19:42:00,"„Хамас” освобождава момиче с българско гражданство, държано като заложник. Това е Даниела Гилбоа, а името ѝ стана известно, след като от групировката публикуваха списък с общо четири жени, които ще бъдат освободени утре съгласно споразумението между Израел и палестинското ислямистко движение  за прекратяване на огъня в Ивицата Газа. Другите три заложници са служещите в израелската армия Карина Ариев, Наама Леви и Лири Албаг, каза говорителят на бригадите ""Изедин ал Касам"" Абу Убайда. Година от терористичната атака: Възпоменание в Софийската синагога Канцеларията на израелския премиер съобщи, че е получила списъка с имената. В неделя, когато влезе в сила споразумението за прекратяването на огъня, ""Хамас"" освободи три израелски жени в замяна на 90 палестински затворници. Това бе първата размяна на израелски заложници срещу палестински затворници от повече от една година насам. След примирието с Израел: ""Хамас"" освободи първите заложници Първата фаза от примирието ще продължи шест седмици, като споразумението предвижда през този период да бъдат разменяни по 50 палестински затворници за всяка освободена жена, която служи в израелската армия. По този начин 200 палестински затворници ще бъдат разменени за четири израелски заложнички. По данни на Израел след освобождаването на трите жени в неделя и откриването на тялото на израелски военнослужещ, изчезнал преди десетилетие, в Газа все още има 94 израелци и чужденци, държани в плен. Споразумението за прекратяване на огъня бе постигнато след преговори, които продължиха с месеци, припомня ""Ройтерс"". Консултациите се водеха с посредничеството на Катар и Египет и подкрепата на САЩ. Благодарение на всички тези усилия огънят в Ивицата Газа бе прекратен за втори път, откакто избухна конфликта през октомври 2023 г. Първото спиране на огъня бе през ноември, но то продължи само една седмица. С три часа забавяне: Примирието между Израел и ""Хамас"" влезе в сила В рамките на първия етап от настоящето примирие ""Хамас"" се съгласи да освободи 33 заложници в замяна на стотици палестински затворници. След това двете страни ще преговарят за размяната на останалите заложници и за изтеглянето на израелските сили от Газа. Израел предприе военната си офанзива в палестинския анклав след нападението на ""Хамас"" на 7 октомври 2023 г., когато по израелски данни ислямистки бойци убиха 1200 души и плениха над 250 души. Оттогава в Газа са били убити над 47 000 палестинци, сочат данни на палестинските здравни власти, отбелязва ""Ройтерс"".",,момиче,уби
"""Ще те приключа, това е краят ти"": Пребиха мъж пред бременната му жена след забележка на пътя",https://nova.bg/news/view/2025/01/24/484863/%D1%89%D0%B5-%D1%82%D0%B5-%D0%BF%D1%80%D0%B8%D0%BA%D0%BB%D1%8E%D1%87%D0%B0-%D1%82%D0%BE%D0%B2%D0%B0-%D0%B5-%D0%BA%D1%80%D0%B0%D1%8F%D1%82-%D1%82%D0%B8-%D0%BF%D1%80%D0%B5%D0%B1%D0%B8%D1%85%D0%B0-%D0%BC%D1%8A%D0%B6-%D0%BF%D1%80%D0%B5%D0%B4-%D0%B1%D1%80%D0%B5%D0%BC%D0%B5%D0%BD%D0%BD%D0%B0%D1%82%D0%B0-%D0%BC%D1%83-%D0%B6%D0%B5%D0%BD%D0%B0-%D1%81%D0%BB%D0%B5%D0%B4-%D0%B7%D0%B0%D0%B1%D0%B5%D0%BB%D0%B5%D0%B6%D0%BA%D0%B0-%D0%BD%D0%B0-%D0%BF%D1%8A%D1%82%D1%8F/,nova.bg,TV news,2025-01-24 07:48:00,"Сигнал за побой след забележка на пътя. Мъж от София и бременната му съпруга потърсиха NOVA, за да разкажат как едва не са били блъснати от пресичащ пътя им автомобил, управляван от жена, докато се движели пеша в квартал ""Драгалевци"". Минути след като изразили възмущението си и продължили по пътя си, друг автомобил настигнал двойката. Шофьорът започнал да бие мъжа и да отправя закани за убийство. Емил и Ганка се надяват с разказа си да помогнат и на други жертви на насилие. Софиянец беше пребит с лопата, има задържани Около 18 ч. в злополучния ден те отиват до куриерска фирма, за да приберат своя пратка. ''Минавайки през кръстовището, което е доста добре осветено, се опитахме да пресечем пред кола, която беше на известно разстояние от нас, но се движеше много бавно. Изведнъж тя ускори и мина много близо, а аз изразих недоволството си, като ударих колата с длан. Шофьорката свали прозореца и каза, че на мястото няма пешеходна пътека, разменихме си реплики. Продължихме по пътя и връщайки се, след като си взехме пратката, кола излетя към нас, а шофьорът се спусна с викове. Нанесе ми побой с юмруци и ритници и ме попита ""ти какви коли ще риташ"". Казваше ми ""ей тука ще те убия, ще те приключа, това ти е краят"". Каза ни, че жена му е бременна, а моята каза, че също е. Запомних номера, успях и да снимам, подадохме сигнал в полицията, имам и медицинско"", спомня си той. Ганка определя побоя като ожесточен. ""Аз бях в шок и ужас какво се случва. Най-близкият ми човек е това. Чувството е неописуемо. Разкрещях се, изпаднах във вцепенение, изпитах чувство за изтичащо време, дори за смърт. Казах му, че съм бременна, но въпреки това продължи да го бие. Човек от близкото заведение се притече на помощ и ги разтърва"", разказа тя. Повече гледайте във видеото.",, жена,"уби, преби, насил, смърт"
Книга вдъхнови създаването на конференция за ранните бракове и домашното насилие у нас,https://nova.bg/news/view/2025/01/23/484840/%D0%BA%D0%BD%D0%B8%D0%B3%D0%B0-%D0%B2%D0%B4%D1%8A%D1%85%D0%BD%D0%BE%D0%B2%D0%B8-%D1%81%D1%8A%D0%B7%D0%B4%D0%B0%D0%B2%D0%B0%D0%BD%D0%B5%D1%82%D0%BE-%D0%BD%D0%B0-%D0%BA%D0%BE%D0%BD%D1%84%D0%B5%D1%80%D0%B5%D0%BD%D1%86%D0%B8%D1%8F-%D0%B7%D0%B0-%D1%80%D0%B0%D0%BD%D0%BD%D0%B8%D1%82%D0%B5-%D0%B1%D1%80%D0%B0%D0%BA%D0%BE%D0%B2%D0%B5-%D0%B8-%D0%B4%D0%BE%D0%BC%D0%B0%D1%88%D0%BD%D0%BE%D1%82%D0%BE-%D0%BD%D0%B0%D1%81%D0%B8%D0%BB%D0%B8%D0%B5-%D1%83-%D0%BD%D0%B0%D1%81/,nova.bg,TV news,2025-01-23 23:20:00,"Книга, вдъхнови създаването на конференция „Момичета с мисия: Образование”, чиято чел е да обедини и насочи погледите на обществото към ранните бракове и домашното насилие като съществуват проблем в българското общество. Бременна и пребита с пръчка: Българка написа книга за ужаса на домашното насилие (ВИДЕО) „Авторката на книгата „Жени, лишени от търпение” Джайли Амаду Амал разказва съдбата на три жени, три млади момичета, които са омъжени против тяхната воля в Камерун. Оказва, се че една история, която се случва в Африка, сред мюсюлманско общество, е универсална”, коментира организаторът на форума и собственик на издателство Виктория Бисерова в студиото на предаването „Социална мрежа” по NOVA NEWS. По нейни думи в конференцията участват над 20 организации, които дългогодишно работят върху обсъжданите проблеми. „Книгата ни дава възможност ни да говорим и да стигнем до различните общности. Има немалко случаи, в които хора са били вдъхновявани”, казва още Бисерова. Повече по темата гледайте във видеото.",,домашното насилие,"преби, насил"
"Съпругата на помощник-капитана: Докато не стъпи на българска земя, не смея да се зарадвам",https://nova.bg/news/view/2025/01/22/484715/%D1%81%D1%8A%D0%BF%D1%80%D1%83%D0%B3%D0%B0%D1%82%D0%B0-%D0%BD%D0%B0-%D0%BF%D0%BE%D0%BC%D0%BE%D1%89%D0%BD%D0%B8%D0%BA-%D0%BA%D0%B0%D0%BF%D0%B8%D1%82%D0%B0%D0%BD%D0%B0-%D0%B4%D0%BE%D0%BA%D0%B0%D1%82%D0%BE-%D0%BD%D0%B5-%D1%81%D1%82%D1%8A%D0%BF%D0%B8-%D0%BD%D0%B0-%D0%B1%D1%8A%D0%BB%D0%B3%D0%B0%D1%80%D1%81%D0%BA%D0%B0-%D0%B7%D0%B5%D0%BC%D1%8F-%D0%BD%D0%B5-%D1%81%D0%BC%D0%B5%D1%8F-%D0%B4%D0%B0-%D1%81%D0%B5-%D0%B7%D0%B0%D1%80%D0%B0%D0%B4%D0%B2%D0%B0%D0%BC/,nova.bg,TV news,2025-01-22 22:36:00,"NOVA разговоря със съпругата на помощник-капитана от Galaxy Leader Данаил Веселинов - Събина Веселинова. Очаква се той и капитан Любомир Чанев да пристигнат на българска земя в четвъртък, след като преди 14 месеца бяха пленени заедно с с целия екипаж на кораба. Събина Веселинова съобщи, че е осъществила контакт със съпруга си. „Беше много щастлив. Докато не стъпи на българска земя, не смея да се зарадвам. Това е нещо, което очаквахме от много месеци. Буквално не можах да повярвам, че се случва. Не мога да го опиша с думи, нереално ми е. Това са месеци мъки и психически тормоз. Беше изключително трудно, особено когато имаш дъщеря, защото трябва да бъдеш силен заради нея. И постоянно трябва да обясняваш и да даваш кураж и надежда. Те вече са в безопасност, което е най-важното и чакаме, и се надяваме на това чудо“, заяви тя. Първи кадри от освобождаването на екипажа на Galaxy Leader (ВИДЕО) „Очаквам да ми се обади, но все още нямам новини. Знам, че са в Оман, само това. Изпрати ми съобщение, някъде около 00 часа през нощта, че ги пускат и аз веднага писах на правителството и те потвърдиха тази информация“, сподели Веселинова. Припомняме, че правителственият самолет кацна малко след 19 часа българско време в Мускат - Оман, където е и българската делагация, водена от външния министър Георг Георгиев. На място е и евродепутатът Елена Йончева. Премиерът Росен Желязков увери, че държавата прави всички необходимо, за да пробере моряците на родна земя. Справка в сайта Flightradar показва, че в четвъртък е планиран нов полет, който трябва да излети около обяд и след 15 часа българско време да прибере моряците Любомир Чанев и Данаил Веселинов.",Елена,съпруга,тормоз
"Мъжът, обвинен от Стефани Иванова в домашно насилие: Ще заведа дело за тази нагла клевета",https://nova.bg/news/view/2025/01/21/484498/%D0%BC%D1%8A%D0%B6%D1%8A%D1%82-%D0%BE%D0%B1%D0%B2%D0%B8%D0%BD%D0%B5%D0%BD-%D0%BE%D1%82-%D1%81%D1%82%D0%B5%D1%84%D0%B0%D0%BD%D0%B8-%D0%B8%D0%B2%D0%B0%D0%BD%D0%BE%D0%B2%D0%B0-%D0%B2-%D0%B4%D0%BE%D0%BC%D0%B0%D1%88%D0%BD%D0%BE-%D0%BD%D0%B0%D1%81%D0%B8%D0%BB%D0%B8%D0%B5-%D1%89%D0%B5-%D0%B7%D0%B0%D0%B2%D0%B5%D0%B4%D0%B0-%D0%B4%D0%B5%D0%BB%D0%BE-%D0%B7%D0%B0-%D1%82%D0%B0%D0%B7%D0%B8-%D0%BD%D0%B0%D0%B3%D0%BB%D0%B0-%D0%BA%D0%BB%D0%B5%D0%B2%D0%B5%D1%82%D0%B0/,nova.bg,TV news,2025-01-21 11:05:00,"Андрей Дянов, създателят на Sofia Riders, отрече всички обвинения в домашен тормоз, които в ефира на ""Здравей, България"" отправи към него майката на двете му дъщери - участничката  в шестия сезон на Hell’s Kitchen Bulgaria Стефани Иванова. По думите ѝ той упражнявал физически и психически тормоз върху нея по време на връзката им. В пост в личния си профил във Facebook Дянов посочва, че неслучайно попечителските права за децата им са присъдени на него и се заканва да съди Иванова за клевета. NOVA го потърси за коментар, но до този момент той отклонява поканата ни за разговор. ""По принцип винаги съм избягвал да занимавам хората с лични драми и неволи, тъй като съм се водел от принципа, че ""като се бориш с прасе и двамата се каляте, но на прасето това му харесва"". В случая нещата са неизбежни и няма да оставя името и авторитетът ми да бъдат опетнени от човек, съден N на брой пъти от различни хора и по различни дела, като причини за това са домашно насилие, унищожаване на имущество, нападение и какво ли още не. Последният също така е приеман в психиатрия, лежал е в Токсикология за опит за самонатравяне, отнемана му е шофьорската книжка за 2 години заради отказ да даде проба за алкохол и наркотици. С въпросната ""дама"" не живеем заедно от 3 години, като оттогава досега сме се виждали няколко пъти, и то в присъствието на нейни близки"", пише Дянов в социалната мрежа. Стефани Иванова: Бащата на децата ми ме изкара наркоманка и алкохоличка, за да ми ги отнемат И допълва: ""Аз лично никога не съм бил съден, нито някога обвиняван от прокуратура и от каквито и да било държавни институции. Може да си зададете въпроса защо съдът отсъди привременните мерки за отглеждане на нашите деца на мен, а не на въпросната ""жертва"", при положение че това е изключително рядка практика. На мой гръб не може да се прави PR от неуспели тв ""звезди"", търсещи лайкове, лесни пари, състрадание, споделяния, евтина популярност, телевизионно време и сензации, в безсилието си да се преборят срещу закона и истината! Давам мъжка дума, а тези които ме познават, знаят, че думата ми на две не се цепи. За предстоящото дело, което ще заведа за тази изключително дръзка и нагла клевета, при спечелването му, в което аз силно вярвам, ще даря огромната част от парите за развойна дейност за лечение на психични разстройства и борба с домашното насилие"". ",,домашно насилие,"домашно насилие, тормоз, насил, жертва"
"Участничка в Hell’s Kitchen Bulgaria твърди, че е жертва на домашно насилие",https://nova.bg/news/view/2025/01/20/484451/%D1%83%D1%87%D0%B0%D1%81%D1%82%D0%BD%D0%B8%D1%87%D0%BA%D0%B0-%D0%B2-hells-kitchen-bulgaria-%D1%82%D0%B2%D1%8A%D1%80%D0%B4%D0%B8-%D1%87%D0%B5-%D0%B5-%D0%B6%D0%B5%D1%80%D1%82%D0%B2%D0%B0-%D0%BD%D0%B0-%D0%B4%D0%BE%D0%BC%D0%B0%D1%88%D0%BD%D0%BE-%D0%BD%D0%B0%D1%81%D0%B8%D0%BB%D0%B8%D0%B5/,nova.bg,TV news,2025-01-20 20:47:00,"Сладкарката Стефани Иванова от шестия сезон на Hell’s Kitchen Bulgaria публикува снимки със синини по лицето си. Тя твърди, че е жертва на домашно насилие. Във Facebook тя написа: „Доста дълго събирах смелост да стигна до това решение, но след като това се отразява и върху децата ми, ще имам нужда от вашата подкрепа и съдействие”. Според текста на публикацията ѝ тя е била насилвана от бившия си мъж, без да споменава имената им. Няма информация и кога се е случвало това. Тежка катастрофа на „Цариградско шосе“ взе жертва (ВИДЕО+СНИМКИ) От Софийската районна прокуратура съобщиха за NOVA, че при тях не е постъпвал сигнал за домашно насилие от Иванова. Но имало два сигнала срещу бащата на децата ѝ, но свързани родителски отношения. Софийският районен съд от декември пък разпоредил като привременна мярка - децата да живеят при бащата.",,домашно насилие,"домашно насилие, насил, жертва"
