Title,URL,Source,Type,DateTime,Article,Location,Keywords1,Keywords2
Ужасяващата реалност на домашното насилие оживява в нов мултимедиен проект на фондация „Документалистите“,https://btvnovinite.bg/bulgaria/uzhasjavashtata-realnost-na-domashnoto-nasilie-ozhivjava-v-nov-multimedien-proekt-na-fondacija-dokumentalistite.html,btvnovinite.bg,TV news,2025-06-12 14:55:00,"Новата документална мултимедийна история на фондация „Документалистите“ - „Пиявици и рози“, разбива тишината около една от най-болезнените теми в България – домашното насилие. Проектът събира реални истории на жени от цялата страна – различни по възраст, етнос и социално положение, но обединени от едно: насилието, което са преживели, и куража да говорят за него. Историята можете да прочетете тук: https://story.den.fm/piyavici-i-rozi/ „Повечето хора научават за случаите на домашно насилие едва когато стане твърде късно и черните хроники стигнат до медиите. Но в тези фатални истории жената я няма. Буквално! Ние искахме да дадем глас на жените, оцелели и излезли от подобни връзки, за да разкажат цялата история – как се стига до момента, в който собственият ти дом става най-опасното място на света “, казват от екипа. Проектът е резултат от почти едногодишна работа на журналист и фотограф – Димитър Панайотов и Александър Николов, които пътуват из страната, интервюират десетки жени и създават документален разказ, който е едновременно свидетелство, протест и зов за действие. Кампанията към проекта, създадена от рекламна агенция MUCH BETTER, превъплъщава документалните разкази в книги и филми на ужасите – но с едно важно уточнение: това не е измислица, а е ужасяващата реалност. Всеки „плакат“ е врата към отделна истинска история на болка, страх, контрол, вина... но и на надежда за изход и промяна. Защото за всяка жена, която е намерила силите да говори, има още десетки, които все още мълчат – от страх, срам или липса на подкрепа. Този проект е за тях. За да им каже: има изход, можете да промените края на историята. Последвайте ни за още актуални новини в Google News Showcase Последвайте btvnovinite.bg във VIBER Последвайте btvnovinite.bg в INSTAGRAM Последвайте btvnovinite.bg във FACEBOOK Последвайте btvnovinite.bg в TIKTOK ",,домашното насилие,"домашно насилие, насил"
"20 години затвор за син, убил майка си заради имоти в Сандански",https://btvnovinite.bg/bulgaria/20-godini-zatvor-za-sin-ubil-majka-si-zaradi-imoti-v-sandanski.html,btvnovinite.bg,TV news,2025-06-12 13:20:00,"Окончателна осъдителна присъда от 20 години лишаване от свобода е постановена за син, убил майка си по особено мъчителен начин, съобщи Окръжната прокуратура в Благоевград. Към 2020 г. осъденият живеел с 81-годишната си майка в Сандански. От години мъжът упражнявал психически и физически тормоз върху възрастната жена, за което тя отказвала да подаде сигнал в полицията. Повод за тормоза били наследствените имоти, като синът настоявал майка му приживе да му прехвърли своя дял. Особено агресивен той ставал след употреба на алкохол. В късните часове на 11 март 2020 г. мъжът се прибрал вкъщи в нетрезво състояние. Отново повдигнал въпроса за имотите в разговор с майка си, като се държал грубо с нея. След двучасов словесен тормоз започнал да ѝ нанася силни удари с ръце и крака по лицето, главата и тялото. Пострадалата получила кръвотечение от устата, носа и на ръката. Оставяйки я в окаяно физическо и психическо състояние, насилникът легнал да спи. След като се събудил на другия ден той отишъл при майка си. Видял, че тя има синини по лицето и врата, засъхнала кръв по устата, но въпреки това предизвикал скандал и отново ѝ нанесъл побой. Няколко часа по-късно жената била открита в безпомощно състояние. За случилото се била сигнализирана полицията, а пострадалата – транспортирана в болница. Въпреки опитите на лекарите да я спасят тя починала. Наложеното наказание от 20 години лишаване от свобода 62-годишният мъж ще изтърпява при първоначален строг режим. Последвайте ни за още актуални новини в Google News Showcase Последвайте btvnovinite.bg във VIBER Последвайте btvnovinite.bg в INSTAGRAM Последвайте btvnovinite.bg във FACEBOOK Последвайте btvnovinite.bg в TIKTOK","Благоевград, Сандански",майка,"уби, тормоз, насил"
Жена вижда майка си със синини. Персоналът в Ягода: Възрастните често падат. А след това тя умира,https://btvnovinite.bg/predavania/tazi-sutrin/zhena-poluchava-snimki-na-majka-si-sas-sinini-personalat-v-jagoda-vazrastnite-hora-chesto-padat-a-sled-tova-tja-umira.html,btvnovinite.bg,TV news,2025-06-11 10:07:00,"Ужасяващи разкази за условията в Ягода от близки на хора, приети там. Жена губи майка си броени дни след като я води в нелегалния хоспис. Преди да почине, ѝ изпращат снимки, на които вижда, че възрастната жена е цялата в синини. Обясненията на персонала - възрастните хора често падат. Този жена иска да скрием лицето ѝ от страх, че служители на дома могат да я разпознаят. 75-годишната ѝ майка е с деменция, макар и не в тежка форма, но приема медикаменти. Дъщерята започва да търси хоспис и така преди два месеца стига до Ягода. Първо по телефона. „В сряда се чухме с господин Желев, каза че има едно свободно място и ако искаме още в неделя можем да я закараме, и я закарахме. Казахме му, че е дементно болна, попита ме какви лекарства взема, казах му, той каза - да, като на повечето дементно болни. Каза, че ако тези лекарства не действат, ще им дават техни лекарства, имало си психиатър, който ще им назначи лекарства“, коментира жената.  След няколко дни тя води майка си, но при приемането не я допускат да види условията вътре. „Сложиха я в инвалидна количка, попитахме дали не можем да видим вътре, казаха не може, само тук до портала. Елате да ви оправим документите, оправиха документите , взеха таксата до края на месеца, и с това приключи. Бяхме толкова притеснени за нея къде отива“, разказва още жената. Притесненията продължават и дъщерята настоява пред жена от персонала, която се представя като главна сестра да вижда майка си. Два пъти ѝ изпращат снимки от дома, на които възрастната жена е паднала от леглото и цялата в синини. Съдържанието им е шокиращо и въпреки разрешението на близките - не ги показваме.  „Снимките, които ми пращаха бяха покъртителни… Тези снимки, които ми изпратихте са наистина ужасяващи... На едната снимка беше надолу с главата паднала, на другата легнала, синя цялата. Преди това си спомням в един разговор, че носът ѝ беше син и ми казаха, че също е паднала. Когато говорихме по вайбър, носът ѝ беше като сцепен. Казаха, че е паднала.  Аз си мисля, че са били заключени в тези стаи и изобщо не са поглеждани“, коментира жената. Виждайки синините и раните на майка си, обяснени с множество падания, жената отново настояване да види на камерата.  „Тя само плачеше, нищо не казваше, само плачеше. Забелязах, че колкото пъти звъня беше облечена по един и същ начин - 2-3 седмици с една и съща блуза. В дома казаха да не носим много неин багаж, защото имало дрехи от дарители, помощи. Ние въпреки всичко занесохме каквото трябваше“, разказва жената, като допълва, че тази блуза дори не била на майка ѝ. Оказва се, че в нелегалния хоспис решават да спрат и лекарствата за деменция на майка й, които жената пие с години. „Те казаха, че майка ми е в толкова тежка форма на деменция, че няма смисъл да ѝ дават лекарства - няма какво да се подобри повече при нея . А тези, които е вземала до момента, не са й ги давали“, разказва жената.  Заради всичко това жената решава да прибере майка си, но се оказва късно . На 14- тия ден след приемането ѝ от дома звънят, че е починала.  „В 7 часа мисля, че беше , главната сестра пак ми се обади – „елате, бабата почина“. Аз изпаднах в шок, помня „бабата почина, имате два часа да отидете в погребална агенция, изпращайте някой да идва да я взема ..."", споделя жената.  В смъртния акт е записано, че тя е починала от сърдечна недостатъчност, но според близките никога не е имала подобни оплаквания. Последвайте ни за още актуални новини в Google News Showcase Последвайте btvnovinite.bg във VIBER Последвайте btvnovinite.bg в INSTAGRAM Последвайте btvnovinite.bg във FACEBOOK Последвайте btvnovinite.bg в TIKTOK",,майка,"уби, смърт"
"18-годишен се заби в дърво край Пловдив, пострадало е 16-годишно момиче",https://btvnovinite.bg/bulgaria/18-godishen-se-zabi-v-darvo-kraj-plovdiv-postradalo-e-16-godishno-momiche.html,btvnovinite.bg,TV news,2025-06-10 09:17:00,"18-годишен шофьор се заби в дърво край Пловдив. 16-годишно момиче - негова спътничка, е пострадало. Инцидентът е станал късно снощи между селата Спахиево и Сираково, съобщиха от полицията. 18-годишен от Хасково шофирал автомобил, но загубил контрол над управлението, излязъл от пътя и се е ударил в дърво. 16-годишната му спътничка е пътувала на задна дясна седалка. Тя е настанена в МБАЛ Хасково. Няма опасност за живота ѝ. Пробите на водача са отрицателни, съставен му е акт, предава БГНЕС. През изминалото денонощие в страната са станали 21 тежки катастрофи. Един човек е загинал, а други 35 са били ранени. В София са регистрирани 26 леки пътнотранспортни произшествия и две тежки катастрофи с четирима ранени. От началото на годината при катастрофи в страната са загинали 161 души. Последвайте ни за още актуални новини в Google News Showcase Последвайте btvnovinite.bg във VIBER Последвайте btvnovinite.bg в INSTAGRAM Последвайте btvnovinite.bg във FACEBOOK Последвайте btvnovinite.bg в TIKTOK ",Хасково,момиче,уби
"„Не филм на ужасите, а ужасяваща реалност“: През 2024 г. 6400 жени са пострадали от домашно насилие",https://btvnovinite.bg/predavania/tazi-sutrin/ne-film-na-uzhasite-a-uzhasjavashta-realnost-prez-2024-g-6400-zheni-sa-postradali-ot-domashno-nasilie.html,btvnovinite.bg,TV news,2025-06-09 09:13:00,"От ефира на bTV стартира кампанията „Не филм на ужасите, а ужасяваща реалност“, насочена срещу насилието над жени. Проектът може да се види на www.den.fm, той е в 4 части, историите са разказани като книга – увлекателно и емоционално. На създателите им е отнело 9 месеца, за да заснемат всички разкази. Статистиката показва, че най-опасното място за една жена е нейният дом – 16 са убитите жени в България в следствие на домашно насилие през последните само пет години. За мащабите на проблема разказаха в „Тази сутрин“ авторът на креативната концепция на кампанията Мария Милушева и организаторът Димитър Панайотов. Организаторите са известни като „Документалистите“ и обясниха, че на кампанията може да се гледа като на журналистически проект, който е базиран на разговори с много жени в продължение на почти една година. Само за 2024 г.  над 53 хил. сигнала за домашно насилие са подадени на тел. 112, установени са 6400 пострадали. „Всеки, който прочете тези истории ще си даде сметка всъщност какъв ужас преживява една жена, когато най-близкия ѝ човек се окаже, че е най-голямата опасност за живота ѝ“, каза Милушева. Панайотов допълни, че тези истории са много тежки, но и много вдъхновяващи: „Тези жени са много смели, те застават с лицето си, с името си, връща се към травмите си, най-ужасните си спомени, за да разкаже и да помогне на други жени“. Милушева обясни, че всички интервюирани жени чувстват липса на подкрепа от близките си и от държавата. Сред тях има жени от големи градове, с престижни професии и добри доходи – няма застраховани. Тя обясни, че е много важно, когато една дама осъзнае, че има връзка с насилник – да го напусне. Последвайте ни за още актуални новини в Google News Showcase Последвайте btvnovinite.bg във VIBER Последвайте btvnovinite.bg в INSTAGRAM Последвайте btvnovinite.bg във FACEBOOK Последвайте btvnovinite.bg в TIKTOK",," жени, домашно насилие","домашно насилие, уби, насил"
"„Домът на ужасите“: Разказ на жена, настанена там - бой, глад, връзване, без лекар и под ключ",https://btvnovinite.bg/bulgaria/domat-na-uzhasite-razkaz-na-zhena-nastanena-tam-boj-glad-vrazvane-bez-lekar-i-pod-kljuch.html,btvnovinite.bg,TV news,2025-06-08 19:21:00,"Години бой и недохранване. Това разказва възрастна жена, която до вчера е живяла в ""дома на ужасите"" в село Ягода. Властите разбиха нелегалната схема, изведоха 75 души - някои от тях в тежко състояние, и запечатаха сградите. С потърпевшата, оцеляла от нечовешкото отношение, успя да разговаря Мария Георгиева. Като ад определя последните четири години от живота си 74-годишната Милка Ралева, с която се срещнахме днес. Тя е била в дома и казва, че благодарение на Бог се е спасила.  Жена на 89 години обаче, след престоя си там, загуби пръсти и част от петата си след спешна ампутация  в болницата в Стара Загора. Друга жена на 84 години я чака същата интервенция. Всичко това може би нямаше да се случи, ако близките, доверили се на грижата на този незаконен старчески дом, се бяха интересували повече за здравето на роднините си и условията, при които живеят. Милка Ралева влиза в дома в Ягода за месец и остава четири години.  „Болна съм, гърдите ме болят. Питаш ли как съм изкарвала – гладна съм, жадна съм. От ушити ми тече гной“, разказва възрастната жена. Четири години, приз които жената разказва, че оцелява благодарение на Бог. „Заключват ни като кучета още в 6 часа. Дадат две филии хляб. Питаш ли в тази горещина вътре, не отварят мрежата. Ще избягаме и затова ги е страх. Много трудно прекарах“, разказва Милка Ралева. „Много хора умряха – гладни, без доктори, рани. Връзват хората. Мръсотия, не смееш да живееш вътре“, казва още жената.  Днес Милка се чувства спасена в очакване на някоя от дъщерите си. „Сега съм добре. От вчера съм навън, няма да ме бият, няма да ме тормозят“, казва тя. Това, че животът в дома е бил ад службите установяват сега, след като влизат с полиция, защото два пъти преди това са гонени и заплашвани. 75-те възрастни, открити заключени в незаконните хосписи, са изведени. Екип от Центъра за психично здраве е прегледал всички. Установено е, че 33-ма са с психични разстройства и деменция. 20 са настанени в болницата в Стара Загора и в психиатрията в Раднево. Шестима са с повдигнати обвинения. Сред тях са и медицинска сестра и санитарка от Центъра за спешна медицинска помощ в Стара Загора. Заработвали допълнително в хосписа.  В ареста с обвинение от днес е и 62-годишният баща на един от управителите на фирмите, за когото се предполага, че е в основата на схемата. Тепърва предстои да се разследва дали с данните на с данните им е злоупотребено. „Ще направим проверки за това дали има разпоредителни сделки с техни имоти, дали са си прехвърлили имота на някой през последните години. Има нещо подозрително там“, заяви правосъдният министър Георги Георгиев. 990 лева е плащал за стая всеки от възрастните хора, настанени в незаконния хоспис. Годишно нелегалната социална услуга е генерирала приходи от близо милион. Историята отекна и на Запад. Британското издание ""Дейли мейл"" подробно описва разкритията от село Ягода в днешното си онлайн издание. Последвайте ни за още актуални новини в Google News Showcase Последвайте btvnovinite.bg във VIBER Последвайте btvnovinite.bg в INSTAGRAM Последвайте btvnovinite.bg във FACEBOOK Последвайте btvnovinite.bg в TIKTOK","Раднево, Стара Загора", жена,"уби, тормоз"
