Title,URL,Source,Type,DateTime,Article,Location,Keywords1,Keywords2
35-годишна жена от Бургас почина след скандал с мъж в Созопол: Той е задържан,https://btvnovinite.bg/bulgaria/35-godishna-zhena-ot-burgas-pochina-sled-skandal-s-mazh-v-sozopol-toj-e-zadarzhan.html,btvnovinite.bg,TV news,2025-06-06 07:44:00,"58-годишен мъж от Созопол е задържан за срок до 24 часа, след възникнало спречкване с 35-годишна жена от Бургас, прераснало в сбиване, в резултат на което тя починала. Инцидентът е възникнал в обитавана от мъжа къща, разположена на созополската улица „Стара планина“ 22, по повод неуредени финансови взаимоотношения и съдебно решение в тази връзка, прехвърлящо собствеността на къщата на бургазлийката. Около 22:25 ч. е получено съобщение за възникнал скандал на адреса, като дошлите на място полицейски служители намерили тялото на 35-годишната жена с видими следи от насилие. Извършени са множество процесуално-следствени действия, а тялото на бургазлийката е откарано за аутопсия в отделение „Съдебна медицина“ към УМБАЛ Бургас.  Извършителят на деянието е задържан за срок до 24 часа.  Работата по образуваното досъдебно производство продължава. Последвайте ни за още актуални новини в Google News Showcase Последвайте btvnovinite.bg във VIBER Последвайте btvnovinite.bg в INSTAGRAM Последвайте btvnovinite.bg във FACEBOOK Последвайте btvnovinite.bg в TIKTOK","Бургас, Созопол", жена,насил
"Майка и син изнудвали и заплашвали мъж, като му поискали 500 000 евро",https://btvnovinite.bg/bulgaria/majka-i-sin-iznudvali-i-zaplashvali-mazh-kato-mu-poiskali-500-000-evro.html,btvnovinite.bg,TV news,2025-06-04 14:59:00,"Софийската районна прокуратура привлече към наказателна отговорност 43-годишна жена и 18-годишния ѝ син за изнудване. На 26 януари тази година в с. Бистрица, обвиняемите Р.И. и В.А. с цел да принудят мъж да им предаде парична сума в размер на 500 000 евро, го заплашили с насилие и отправили заплахи за убийство срещу сина му. Обвиняемите оставили пред входната врата на къщата му кутия, в която имало поставени цветя и лист хартия със заплашителен текст на чужд език. По случая е образувано досъдебно производство за престъпление, за което се предвижда наказание „лишаване от свобода“. Обвиняемите са задържани за срок до 72 часа. Днес наблюдаващ прокурор внесе искане в съда за определяне на мярка „задържане под стража“ спрямо Р.И. и В.А. Разследването по случая продължава. Последвайте ни за още актуални новини в Google News Showcase Последвайте btvnovinite.bg във VIBER Последвайте btvnovinite.bg в INSTAGRAM Последвайте btvnovinite.bg във FACEBOOK Последвайте btvnovinite.bg в TIKTOK",с. Бистрица,майка,"уби, насил"
Окончателно: Анка Михайлова получи осем години затвор за смъртта на 2-годишната си осиновена дъщеря,https://btvnovinite.bg/bulgaria/okonchatelno-anka-mihajlova-poluchi-osem-godini-zatvor-za-smartta-na-2-godishnata-si-osinovena-dashterja.html,btvnovinite.bg,TV news,2025-06-03 15:46:00,"Върховният касационен съд (ВКС) остави в сила решението на Апелативен съд - Пловдив, с което на Анка Михайлова е наложено наказание от осем години затвор за причинената смърт по непредпазливост на осиновената ѝ дъщеря през 2022 г. в Пловдив, съобщиха от пресцентъра на съда. Подсъдимата е призната за виновна в това, че на 16.10.2022 г. в гр. Пловдив е причинила по непредпазливост смъртта на двегодишната Севда вследствие на умишлено нанесена на 23.09.2022 г. тежка телесна повреда. Касационната инстанция не приема довода, че обясненията на подсъдимата са игнорирани в резултат на неправилно формирано вътрешно убеждение на предходните съдилища и позоваване на експертни заключения, които се „клатушкат“ и не отчитат свидетелските показания, пише БТА. Вещите лица са установили 25 увреждания по тялото на двегодишната Севда и 9 увреждания по главата, част от които са в резултат на захапвания. Много от тях са причинени няколко дни преди инцидента, като безспорно е опровергана тезата на защитата, че тези стари наранявания са свързани с битов инцидент от паднали столове върху тялото на детето. Експертите са категорични, че причина за смъртта е насилствена травма на главата, получена след силно разклащане, което се описва като Синдром на разклатеното бебе, съчетан с удар от човешка ръка. Малката Севда беше приета на 23 септември 2022 г. в тежко състояние в УМБАЛ ""Свети Георги""- Пловдив. Анка Михайлова - осиновителка на детето, бе арестувана на 24 септември, след като лекари от болницата сигнализират в полицията, че при тях е постъпило дете, за което има съмнение за домашно насилие. Детето почина на 16 октомври 2022 г. Последвайте ни за още актуални новини в Google News Showcase Последвайте btvnovinite.bg във VIBER Последвайте btvnovinite.bg в INSTAGRAM Последвайте btvnovinite.bg във FACEBOOK Последвайте btvnovinite.bg в TIKTOK ",гр. Пловдив, дъщер,"домашно насилие, насил, смърт"
"Вместо да празнува 1 юни, тя е на протеста срещу войната на пътя: Най-добрата приятелка на Сияна с призив",https://btvnovinite.bg/bulgaria/vmesto-da-praznuva-1-juni-tja-e-na-protesta-sreshtu-vojnata-na-patja-naj-dobrata-prijatelka-na-sijana-s-priziv.html,btvnovinite.bg,TV news,2025-06-01 19:19:00,"Бдение и протест срещу войната на пътя в празничния 1-ви юни. Почернени родители и сдружение „Ангели на пътя“ се събраха, за да поискат мерки и повече контрол. Демонстрацията премина под надслов „Нито едно дете повече!“. Родители на деца, загинали в катастрофи, се събраха в така нареченият триъгълник на властта, за да кажат в мъката си, че войната на пътя трябва да спре и че децата заслужават сигурност. Сред тях беше и Николай Попов, бащата на 12-годишната Сияна, която загина на пътя Телиш-Радомирци преди точно 60 дни.  Стотици балони полетяха в небето - в памет на децата, загинали на пътя. А на стълбите пред парламента се събраха почернените им родители. „Тези тука отзад - 240 броя, граждани, също на републиката трябва да се събудят и да разберат, че не може повече да се гаврят с цялото общество и с нас“, призова бащата на Сияна.  Семействата - жертви на войната по пътя, отново настояха за повече контрол,  законодателни промени и бързо правосъдие. Родителите на Филип посрещат за втори път деня на детето без 15-годишния си син, който загина блъснат на пешеходна пътека. Болката им не намалява, защото се оказват съседи с лелята на Сияна.  „Както се казва света е малък и ето че на един и същи етаж - две убити деца“, казва майка му. Като се срещат си казват малко. „Какво да си кажем. Бог да ги прости , макар че на тях Бог няма какво да прощава. Бог трябва да прости на всички тези, които не успяхме да опазим децата си“, казва още тя. Почернените семейства казват, че усещат подкрепа от обществото в каузата си. А в празничния ден много родители дойдоха с децата си, за да изразят съпричастността си. „Исках да им покажа колко е важно да опазим здравето и живота на деца, да опазим всички ние смисъла на нашия живот“, казва една от майките, довеа дъщеря си на протеста. С балон в ръка е и Симона - най-добрата приятелка на Сияна. Вече 60 дни двете не са заедно. „Всички сме тук за да подкрепим Сияна, тя беше много мило дете и не го заслужаваше това“, казва тя. Ако можеш да кажеш нещо на всички от които зависи, какво би било то?, питаме я ние. „Да сме внимателни по улиците и да не се случват повече такива неща“, отговаря ни тя. Ако сега бяхте заедно със Сияна какво щяхте да правите?, питаме още. „Сигурно щяхме да излезем някъде да хапнем да си кажем по една приказка..“, споделя детето. Последвайте ни за още актуални новини в Google News Showcase Последвайте btvnovinite.bg във VIBER Последвайте btvnovinite.bg в INSTAGRAM Последвайте btvnovinite.bg във FACEBOOK Последвайте btvnovinite.bg в TIKTOK",Радомир,приятелк,уби
15-годишен отива на съд за смъртта на майка си,https://btvnovinite.bg/bulgaria/15-godishen-otiva-na-sad-za-ubijstvoto-na-majka-si.html,btvnovinite.bg,TV news,2025-05-30 11:35:00,"15-годишен от Пловдив се изправя пред съда за смъртта на 52-годишната му майка. Според държавното обвинение ученикът е причинил смърт по непредпазливост. Престъплението е извършено на 13 октомври 2024 г. Той е нанесъл тежка телесна повреда, изразяваща се в коремна травма и кръвонасядане, довела до смъртта на жената. От прокуратурата уточняват, че въпреки възрастта си, момчето е осъзнавало какво върши и значението на действията си. Непълнолетното момче го грози наказание от три до дванадесет години. По делото са извършени разпити на свидетели, изготвени заключенията на множество експертизи, приложени веществени доказателства и др. Спрямо обвиняемия е взета мярка за неотклонение „Под надзора на инспектор от Детска педагогическа стая“. Делото е внесено в Окръжен съд – Пловдив. Последвайте ни за още актуални новини в Google News Showcase Последвайте btvnovinite.bg във VIBER Последвайте btvnovinite.bg в INSTAGRAM Последвайте btvnovinite.bg във FACEBOOK Последвайте btvnovinite.bg в TIKTOK",,майка,смърт
Дъщеря намери майка си пребита до смърт в апартамент в Стара Загора,https://btvnovinite.bg/bulgaria/zhena-na-66-g-ot-stara-zagora-e-pochinala-sled-poboj.html,btvnovinite.bg,TV news,2025-05-27 12:21:00,"Жена на 66 години от Стара Загора е починала след нанесен побой. Това съобщиха от пресцентъра на Областната дирекция на МВР. Сигналът е подаден в 11:35 ч. вчера от 41-годишна жена, че намерила майка си - 66-годишна жена, починала в апартамент в Стара Загора. Полицейските служители са открили на място по тялото на жената следи от насилие. В Първо Районно управление - Стара Загора е започнато досъдебно производство. Като съпричастен към извършеното престъпление е задържан 69-годишен мъж, който при проведена беседа признал, че на 25 май, около обяд, е нанесъл побой на 66-годишната жена. Мъжът е задържан за срок до 72 часа. Работата по случая продължава в рамките за започнатото досъдебно производство под надзора на Окръжна прокуратура - Стара Загора. Последвайте ни за още актуални новини в Google News Showcase Последвайте btvnovinite.bg във VIBER Последвайте btvnovinite.bg в INSTAGRAM Последвайте btvnovinite.bg във FACEBOOK Последвайте btvnovinite.bg в TIKTOK",Стара Загора,майка,насил
"Съпруг стреля по жена си в Русе, пускат го под домашен арест – тя живее в страх",https://btvnovinite.bg/bulgaria/saprug-strelja-po-zhena-si-v-ruse-puskat-go-pod-domashen-arest-tja-zhivee-v-strah.html,btvnovinite.bg,TV news,2025-05-26 20:17:00,"Жената, нападната миналата седмица от съпруга си на улица в Русе, се страхува за своя живот. Мъжът беше пуснат под домашен арест часове, след като блъсна колата ѝ, потроши я с чук и стреля с пистолет. Близките ѝ се притесняват, тъй като съпругът има и друго оръжие, което не му е отнето. Проблемите между Сезян и съпруга ѝ започват преди около 3 месеца, когато решават да се разведат. Постепенно мъжът става агресивен. „Вечер ме гонеше от жилището, като ми казваше „детето остава тук, ти се махай“.., Заплахи за убийство, „ще те убия“, после казваше „аз ще се самоубия“, разказва Сезян. След случай на побой жената си вади ограничителна заповед, която мъжът нарушава. Праща ѝ и заплашителни съобщения. „Не разбра ли, че парите няма да получиш отникъде, трябва да съм мъртъв, за да получиш ти пари на твоя сметка. Детето ще получи всичко“, гласи едно от тях. Така се стига до деня, в който я напада край детската градина. „Започна да стреля, за голям късмет точно зад мен нямаше никакви коли, а по принцип пред градината е пълно с коли, с които родители оставят децата си…..Изпитах ужас, бях в шок, не можех да се успокоя часове наред, след това ме приеха в болница… Барикадирани сме вкъщи, никой никъде не ходи“, казва Сезян. Мъжът е задържан, но съдът го пуска под домашен арест въпреки искането на прокуратурата за най-тежката мярка. Утре ще бъде внесен протест срещу решението на съда, а близките настояват за по-строги законови промени. Последвайте ни за още актуални новини в Google News Showcase Последвайте btvnovinite.bg във VIBER Последвайте btvnovinite.bg в INSTAGRAM Последвайте btvnovinite.bg във FACEBOOK Последвайте btvnovinite.bg в TIKTOK",Русе, жена,уби
"Мъжът, нападнал съпругата си  в Русе с чук и пистолет, е с мярка ""домашен арест""",https://btvnovinite.bg/bulgaria/mazhat-napadnal-saprugata-si-v-ruse-s-chuk-i-pistolet-e-s-mjarka-domashen-arest.html,btvnovinite.bg,TV news,2025-05-24 10:40:00,"50-годишният мъж, който вчера нападна съпругата си в Русе, като блъсна колата й, троши я с чук и стреля с пистолет, е с мярка ""домашен арест"". Определението е на Русенския районен съд, а заседанието се е състояло още вчера следобед. От Районна прокуратура-Русе внесоха искане за най-тежката мярка ""задържане под стража"", след като преди това удължиха срока на задържането на нападателя на 72 часа и му повдигнаха три обвинения - за нарушение на заповедта за защита от домашно насилие, за закана с убийство и в условията на домашно насилие и за хулиганство с МПС, извършено с изключителна дързост и цинизъм. Както bTV съобщи, вчера малко преди 8 часа жената на обвиняемия, с която са в процес на развод, е оставила детето на детска градина, когато автомобилът на мъжа й е навлязъл срещу нея и е блъснал колата й. Той е излязъл с чук и е започнал да троши автомобила й, като е произвел и изстрели с газов пистолет. Извършителят бе установен и задържан от полицията, след като преди това е напуснал местопроизшествието.  Срещу нападателя има издадена по-рано съдебна заповед за незабавна защита по искане на съпругата му. Той я е нарушавал няколко пъти, преди да се стигне до вчерашния екшън.  Предстои още във вторник да бъде подаден частен протест срещу определението на съда за ""домашен арест"". Последвайте ни за още актуални новини в Google News Showcase Последвайте btvnovinite.bg във VIBER Последвайте btvnovinite.bg в INSTAGRAM Последвайте btvnovinite.bg във FACEBOOK Последвайте btvnovinite.bg в TIKTOK ",Русе,съпруга,"домашно насилие, уби, насил"
"„Батко, той искаше да ме убие“: Жената, нападната с чук и пистолет в Русе, е подавала множество сигнали",https://btvnovinite.bg/bulgaria/batko-toj-iskashe-da-me-ubie-zhenata-napadnata-s-chuk-i-pistolet-v-ruse-e-podavala-mnozhestvo-signali.html,btvnovinite.bg,TV news,2025-05-23 17:28:00,"Екшън в Русе. 50-годишен блъсна колата на съпругата си, после извади чук и пистолет срещу нея. Нападателят е издирен и задържан. „Опасната ситуация се разиграва малко преди 08:00 часа на улица „Доростол“. Жената е оставила детето си на градина, когато автомобилът на съпруга ѝ влиза с мръсна газ срещу движението и блъска колата ѝ. „Чух удар и отидох да видя какво се случва. Тогава видях - от автомобила излезе човек с чук и почна да удря с него по стъклата на другия автомобил, с когото се сблъска“, разказва свидетелка на случилото се. Съпругът, с когото са в развод, вади и пистолет. А според вуйчото на жената Меджнун Мустафов – дори е стрелял по нея. „Не знаем дали е бил боен, или с халосни патрони. Тя е в шок, много изплашена. Каза ми: „Батко, батко, той искаше да ме убие“, разказва Меджнун Мустафов. Срещу мъжа има издадена заповед за защита, но той няколко пъти е нарушавана. За последната седмица срещу него са подавани четири сигнала.  Полицията проверява сигналите. А нападателят е задържан, след като е напуснал мястото на инцидента. Последвайте ни за още актуални новини в Google News Showcase Последвайте btvnovinite.bg във VIBER Последвайте btvnovinite.bg в INSTAGRAM Последвайте btvnovinite.bg във FACEBOOK Последвайте btvnovinite.bg в TIKTOK",Русе, жена,уби
